{
  "schemaVersion": "listening-map.v1",
  "id": "map-duplicate-anchor",
  "itemId": "item-duplicate",
  "itemTitle": "Duplicate Anchor Example",
  "overview": "This fixture exists to verify duplicate anchor repair behavior.",
  "chapters": [
    {
      "id": "ch-repeat",
      "title": "Repeated phrase",
      "description": "The anchor appears more than once in the source.",
      "anchor": "Repeated phrase",
      "resolved": null
    }
  ]
}
